filename,Key Skills,Overall Analysis,Certifications & Courses,Relevant Projects,Soft Skills,Overall Match Score,Projects Relevance Score,Experience Relevance Score,Final Score,Relative Ranking Score
resume_c242f93b9d.pdf,"['Computer Science', 'C', 'Python', 'Java', 'Machine Learning', 'HTML', 'CSS', 'JavaScript', 'Flask', 'SQL', 'TensorFlow', 'Scikit Learn', 'OCR', 'OpenCV', 'NumPy', 'Pandas']","Mahitha K appears to have a strong background in computer science and related technologies, but lacks specific experience in writing, editing professional CVs, and cover letters, which is crucial for the CV Intern position. This mismatch in skills and experience makes Mahitha K's resume less attractive for the job. There is also no indication of strong communication and teamwork skills, essential for this role.","['Salesforce AI Associate – Salesforce', 'Data Science For Engineers – IIT MADRAS with NPTEL(ELITE)', 'AWS Educate – Credly']","['Bug Vidhya: Created an educational website offering Python and Java tutorials, featuring a built-in code editor for real-time code execution.', 'ANPR and ATCC For Smart Traffic Management System: Developed an intelligent traffic management system using Deep Learning for Automatic Number Plate Recognition (ANPR) and Automated Traffic Control System (ATCC).']",['Good People Skills'],3,5,1,450,100.0
resume_c87dc59925.pdf,[],"Krishna's resume highlights strong technical skills in various programming languages and frameworks, but does not explicitly mention the required skills for the CV Intern position, such as strong English writing and editing skills, or knowledge of MS Word and Google Docs. The focus is predominantly technical, which may not fully align with the job requirements.",[],"['Real-Time Group Chat Application', 'Music App']",['Communication and teamwork'],3,2,4,450,100.0
resume_c73713db85.pdf,"['Signal Processing', 'Machine Learning with PyTorch', 'Python', 'IoT Solutions', 'AISSE (2020) – 92%', 'Oracle Certified (OCA, OCP, 2016)', 'AISSCE(2022) – 90%', 'Eagle River High School, WI - 2015', 'Excel']","The candidate lacks relevant qualifications and skills for the CV Intern position. He holds relevant project experience in IoT and Machine Learning; however, the main requirements of the job are soft and hard skills which aren't present.",['Certified in Data-analytics (using excel)'],"['IOT solutions for Senior Care', 'Audio Source Separation using python and ML']","['Collaboration', 'Teamwork', 'Communication skills']",4,3,2,375,75.0
resume_c5bc434afc.pdf,"['Programming Languages: Java', 'Frameworks: Spring Boot', 'Databases: MySQL', 'Other Tools: Eclipse IDE, Maven, Hibernate ORM, XAMPP, Java Swing, Apache']","Aaditya Yadav is a skilled Computer Science and Engineering student with a strong technical background in backend development. While the resume showcases proficiency in various technical skills such as Java, Spring Boot, MySQL, and RESTful APIs, it lacks direct relevance to the job description for a CV intern which focuses on writing, editing, and formatting CVs and cover letters.",[],['None'],"['Strong writing and editing skills in a non-professional context', 'Attention to detail and accuracy', 'Good communication and teamwork skills']",4,0,2,150,0.0
resume_c7672a8cc6.pdf,"['Written Communication', 'Attention to detail', 'Good communication', 'Teamwork']","The candidate possesses moderate matching skills to the role based on the given job description. The candidate excels in technical and programming skills but lacks foundational skills such as writing, editing, and MS Word proficiency, which are mandatory for the CV Intern position.",[],[],"['Communication', 'Time Management']",6,2,0,150,0.0
