filename,Key Skills,Overall Analysis,Certifications & Courses,Relevant Projects,Soft Skills,Overall Match Score,Projects Relevance Score,Experience Relevance Score,Final Score,Relative Ranking Score
resume_c242f93b9d.pdf,"['Python', 'NumPy', 'Pandas', 'TensorFlow', 'OCR', 'OpenCV']","The candidate has a solid background in various programming languages and relevant ML libraries. They have experience in building and deploying machine learning models, though the need for more specific experience with model optimization and deployment processes in production is noted. The candidate's projects and certifications align well with the core requirements of an AI Engineer role, but the resume lacks explicit mention of experience with Docker, Git, AWS/GCP, or REST APIs.","['Salesforce AI Associate', 'Data Science For Engineers – IIT Madras with NPTEL(ELITE)', 'AWS Educate – Credly', 'IEEE XTREME ENCODE(VIRTUAL)']","['ANPR and ATCC For Smart Traffic Management System (Deep Learning, TensorFlow, CNNs, OCR, YOLO Model)']","['Machine Learning', 'Data Analytics', 'Frontend Development']",6,8,3,825,100.0
resume_c5bc434afc.pdf,"['Java', 'Spring Boot', 'RESTful APIs', 'MySQL', 'ORM (Hibernate)', 'Backend Development', 'Problem Solving', 'Teamwork']",,[],"['CarCaddy - Car Rental Automation System (Infosys Springboard Internship)', 'Delivery Route Optimization', 'Medical Management System']","['Problem Solving', 'Teamwork', 'Communication']",6,4,7,825,100.0
resume_c7672a8cc6.pdf,"['Python', 'Machine Learning', 'Deep Learning', 'Data Structures', 'Algorithms', 'Natural Language Processing']","Meenakshy S has strong fundamentals in Machine Learning, Deep Learning, and Natural Language Processing. Her projects show practical application of these skills, including neural networks and signal processing. She also has experience with data preprocessing and model deployment. However, she lacks experience with specific tools like TensorFlow/PyTorch and Docker, and she does not have any noted experience with CI/CD pipelines or vector databases. She does not have industry experience yet, which is a notable gap given the job requirements.",[],"['Alzheimer’s Classification using EEG: Developed a CNN-based classification model to analyze EEG signals which involves supervised learning and deep learning.', 'Abusive Tamil and Malayalam Text Detection: Used XLM-RoBERTa embedding for detecting abusive comments in Tamil and Malayalam, demonstrating NLP skills.']","['Time Management', 'Verbal and Written Communication', 'Active Listening', 'Creative Thinking', 'Decision Making', 'Self-Motivation', 'Resilience', 'Ethical Responsibility']",7,8,3,825,100.0
resume_c73713db85.pdf,"['Python', 'PyTorch', 'Librosa', 'IOT Solutions']","Siddharth Saravanans resume highlights strong technical skills in Electronics and Communication engineering with a specific focus on digital communication and signal processing. His skills in Python, PyTorch, and Librosa are relevant to the AI Engineer role, especially for developing ML/DL models. However, he lacks experience in key requirements such as data preprocessing, model training, evaluation, deployment, and the whole ML workflow. His education and skills are quite different from typical requirements for this position, nevertheless his projects demonstrate his capabilities in exploring and developing models involving ML.",[],"[{'Project Title': 'IOT solutions for Senior Care', 'Decription': 'Leverages IoT technology using ESP32 to monitor senior citizens by integrating various sensors and modules.'}, {'Project Title': 'Audio Source Separation using python and ML', 'Description': 'Developed a signal processing model for isolating audio components from mixed audio sources.'}]",['Collaboration'],4,7,3,750,50.0
resume_c87dc59925.pdf,"['Java', 'Python', 'JavaScript', 'MongoDB']","Krishna Bhagat has a strong background in Java and related technologies, which is somewhat relevant to the AI Engineer role but does not fully match the key technical requirements. His experience with Python, which is essential for AI/ML, is limited, and he lacks specific project experience in ML/DL or AI technologies mentioned in the job description.",[],"['Real-Time Group Chat Application', 'Music App']","['Collaboration', 'Adaptability', 'Deadline Management']",4,6,3,675,0.0
